{
  "$schema": "./config.schema.json",
  "schemaVersion": 2,
  "autoMix": {
    "defaultTracks": 6,
    "minTracks": 1,
    "maxTracks": 10
  },
  "liveRefresh": {
    "defaultMinutes": 30,
    "minMinutes": 5,
    "maxMinutes": 120,
    "stepMinutes": 5
  },
  "seasons": {
    "spring": [3, 4, 5],
    "summer": [6, 7, 8],
    "autumn": [9, 10, 11],
    "winter": [12, 1, 2]
  },
  "dayPeriods": [
    {"id": "dawn", "labelZh": "黎明", "windows": ["05:00-07:30"]},
    {"id": "morning", "labelZh": "上午", "windows": ["07:30-12:00"]},
    {"id": "afternoon", "labelZh": "午后", "windows": ["12:00-16:30"]},
    {"id": "dusk", "labelZh": "黄昏", "windows": ["16:30-19:00"]},
    {"id": "night", "labelZh": "夜间", "windows": ["19:00-05:00"]}
  ],
  "sources": {
    "shieh_2015": {
      "title": "Acoustic and Temporal Partitioning of Cicada Assemblages in City and Mountain Environments",
      "url": "https://doi.org/10.1371/journal.pone.0116794",
      "accessed": "2026-07-24"
    },
    "lee_2003_part2": {
      "title": "Taxonomic Review of Cicadidae from Taiwan, Part 2: Dundubiini",
      "url": "https://citeseerx.ist.psu.edu/document?doi=d3cecb395f5af9270b87569c4675e8c642450d08",
      "accessed": "2026-07-24"
    },
    "taieol_meimuna_opalifera": {
      "title": "台湾生命大百科：寒蝉 Meimuna opalifera",
      "url": "https://taieol.tw/pages/93280/articles",
      "accessed": "2026-07-24"
    },
    "taieol_mogannia_hebes": {
      "title": "台湾生命大百科：草蝉 Mogannia hebes",
      "url": "https://taieol.tw/pages/93298/articles",
      "accessed": "2026-07-24"
    },
    "taieol_planopleura_takasagona": {
      "title": "台湾生命大百科：小蟪蛄 Planopleura takasagona",
      "url": "https://taieol.tw/pages/93250/articles",
      "accessed": "2026-07-24"
    },
    "nps_taiwan_cicadas": {
      "title": "台湾国家公园主题网：台湾常见蝉类",
      "url": "https://www.taiwan.nps.gov.tw/home/zh-tw/quarterly/7938/7013",
      "accessed": "2026-07-24"
    },
    "froghome_cicadas": {
      "title": "夜间动物声音资讯网：蝉",
      "url": "https://www.froghome.org/Night/cicada/index.html",
      "accessed": "2026-07-24"
    },
    "moe_tanna_ornatipennis": {
      "title": "教育百科：纹翅暮蝉 Tanna ornatipennis",
      "url": "https://pedia.cloud.edu.tw/Entry/Detail/?title=Tanna%20ornatipennis%20Esaki%2C%201933",
      "accessed": "2026-07-24"
    },
    "euterpnosia_varicolor_review": {
      "title": "Redescription of Euterpnosia varicolor",
      "url": "https://www.readkong.com/page/redescription-of-euterpnosia-varicolor-and-description-of-1752142",
      "accessed": "2026-07-24"
    },
    "japan_hyalessa_sources": {
      "title": "日本大阪市立自然史博物馆与环境省：ミンミンゼミ",
      "url": "https://www2.omnh.jp/learning/ent/semi/minminzemi.html",
      "accessed": "2026-07-24"
    }
  },
  "cicadas": [
    {
      "id": "purana_apicalis",
      "displayOrder": 10,
      "enabled": true,
      "autoEligible": true,
      "autoPriority": 78,
      "commonNameZh": "台湾姬蝉",
      "scientificName": "Purana apicalis",
      "mediaFile": "Purana apicalis - Cicadas in Taiwan.mp4",
      "volume": 60,
      "activeMonths": [5, 6, 7, 8, 9],
      "peakMonths": [],
      "callingWindows": ["05:30-08:00"],
      "evidenceLevel": "high",
      "evidenceNote": "台湾种级文献：成虫5–9月，雄虫通常约05:30–08:00鸣叫。",
      "sourceIds": ["lee_2003_part2"]
    },
    {
      "id": "tanna_sozanensis",
      "displayOrder": 20,
      "enabled": true,
      "autoEligible": true,
      "autoPriority": 65,
      "commonNameZh": "阳明山暮蝉",
      "scientificName": "Tanna sozanensis",
      "mediaFile": "Tanna sozanensis.mp4",
      "volume": 58,
      "activeMonths": [5, 6, 7, 8, 9],
      "peakMonths": [6, 7, 8],
      "callingWindows": ["05:00-07:30", "16:30-19:00"],
      "evidenceLevel": "medium",
      "evidenceNote": "月份为暂定范围；种级资料确认主要在黎明、黄昏及阴天鸣叫。",
      "sourceIds": ["nps_taiwan_cicadas", "froghome_cicadas"]
    },
    {
      "id": "meimuna_opalifera",
      "displayOrder": 30,
      "enabled": true,
      "autoEligible": true,
      "autoPriority": 82,
      "commonNameZh": "寒蝉",
      "scientificName": "Meimuna opalifera",
      "mediaFile": "Meimuna opalifera - Cicadas in Taiwan.mp4",
      "volume": 58,
      "activeMonths": [6, 7, 8, 9, 10, 11],
      "peakMonths": [8, 9, 10],
      "callingWindows": ["06:30-18:30"],
      "evidenceLevel": "high",
      "evidenceNote": "台湾资料为6–11月、8–10月较多；自动录音支持白天鸣叫。",
      "sourceIds": ["taieol_meimuna_opalifera", "shieh_2015"]
    },
    {
      "id": "cryptotympana_holsti",
      "displayOrder": 40,
      "enabled": true,
      "autoEligible": true,
      "autoPriority": 88,
      "commonNameZh": "台湾熊蝉",
      "scientificName": "Cryptotympana holsti",
      "mediaFile": "Cryptotympana holsti - Cicadas in Taiwan.mp4",
      "volume": 54,
      "activeMonths": [5, 6, 7, 8, 9, 10, 11],
      "peakMonths": [6, 7],
      "callingWindows": ["06:30-18:00"],
      "evidenceLevel": "high",
      "evidenceNote": "2011年台湾山地自动录音：5月下半至11月初，6–7月最强，日间鸣叫。",
      "sourceIds": ["shieh_2015"]
    },
    {
      "id": "tanna_ornatipennis",
      "displayOrder": 50,
      "enabled": true,
      "autoEligible": true,
      "autoPriority": 72,
      "commonNameZh": "纹翅暮蝉",
      "scientificName": "Tanna ornatipennis",
      "mediaFile": "Tanna ornatipennis - Cicadas in Taiwan│ Audio only.mp4",
      "volume": 60,
      "activeMonths": [7, 8],
      "peakMonths": [],
      "callingWindows": ["16:30-19:00"],
      "evidenceLevel": "high",
      "evidenceNote": "台湾种级资料：成虫7–8月，主要在傍晚鸣叫。",
      "sourceIds": ["moe_tanna_ornatipennis"]
    },
    {
      "id": "tanna_taipinensis",
      "displayOrder": 60,
      "enabled": true,
      "autoEligible": true,
      "autoPriority": 74,
      "commonNameZh": "太平暮蝉",
      "scientificName": "Tanna taipinensis",
      "mediaFile": "Tanna taipinensis - Cicadas in Taiwan.mp4",
      "volume": 60,
      "activeMonths": [5, 6, 7, 8, 9, 10],
      "peakMonths": [],
      "callingWindows": ["12:30-19:00"],
      "evidenceLevel": "high",
      "evidenceNote": "2011年台湾山地自动录音：5–10月，活动集中于下午至黄昏。",
      "sourceIds": ["shieh_2015"]
    },
    {
      "id": "platypleura_kaempferi",
      "displayOrder": 70,
      "enabled": true,
      "autoEligible": false,
      "autoPriority": 35,
      "commonNameZh": "蟪蛄",
      "scientificName": "Platypleura kaempferi",
      "mediaFile": "Platypleura kaempferi - Cicadas in Taiwan.mp4",
      "volume": 56,
      "activeMonths": [4, 5, 6, 7, 8, 9],
      "peakMonths": [],
      "callingWindows": ["06:00-18:30"],
      "evidenceLevel": "low",
      "evidenceNote": "台湾种级月份边界资料不足；只允许手动播放。",
      "sourceIds": ["nps_taiwan_cicadas"]
    },
    {
      "id": "platypleura_takasagona",
      "displayOrder": 80,
      "enabled": true,
      "autoEligible": true,
      "autoPriority": 80,
      "commonNameZh": "小蟪蛄",
      "scientificName": "Platypleura takasagona",
      "mediaFile": "Platypleura takasagona - Cicadas in Taiwan.mp4",
      "volume": 54,
      "activeMonths": [4, 5, 6, 7, 8],
      "peakMonths": [5, 6],
      "callingWindows": ["05:30-18:30"],
      "evidenceLevel": "high",
      "evidenceNote": "台湾生命大百科记载成虫4–8月；自动录音支持白昼鸣叫。",
      "sourceIds": ["taieol_planopleura_takasagona", "shieh_2015"]
    },
    {
      "id": "platypleura_hilpa",
      "displayOrder": 90,
      "enabled": true,
      "autoEligible": false,
      "autoPriority": 20,
      "commonNameZh": "黄蟪蛄",
      "scientificName": "Platypleura hilpa",
      "mediaFile": "Platypleura hilpa - Cicadas in Taiwan.mp4",
      "volume": 56,
      "activeMonths": [],
      "peakMonths": [],
      "callingWindows": [],
      "evidenceLevel": "unknown",
      "evidenceNote": "尚无足够台湾种级物候与日内资料；只允许手动播放。",
      "sourceIds": []
    },
    {
      "id": "cryptotympana_atrata",
      "displayOrder": 100,
      "enabled": true,
      "autoEligible": true,
      "autoPriority": 86,
      "commonNameZh": "红脉熊蝉",
      "scientificName": "Cryptotympana atrata",
      "mediaFile": "Cryptotympana atrata - Cicadas in Taiwan.mp4",
      "volume": 52,
      "activeMonths": [6, 7, 8, 9],
      "peakMonths": [6, 7],
      "callingWindows": ["06:00-18:30"],
      "evidenceLevel": "high",
      "evidenceNote": "台湾熊蝉属约6–9月；2011年城市自动录音确认白天活动。",
      "sourceIds": ["nps_taiwan_cicadas", "shieh_2015"]
    },
    {
      "id": "meimuna_iwasakii",
      "displayOrder": 110,
      "enabled": true,
      "autoEligible": false,
      "autoPriority": 20,
      "commonNameZh": "岩崎寒蝉",
      "scientificName": "Meimuna iwasakii",
      "mediaFile": "Meimuna iwasakii - Cicadas in Taiwan.mp4",
      "volume": 58,
      "activeMonths": [],
      "peakMonths": [],
      "callingWindows": ["06:00-18:30"],
      "evidenceLevel": "low",
      "evidenceNote": "当前没有可靠的台湾种级月份资料；只允许手动播放。",
      "sourceIds": ["froghome_cicadas"]
    },
    {
      "id": "mogannia_formosana",
      "displayOrder": 120,
      "enabled": true,
      "autoEligible": true,
      "autoPriority": 76,
      "commonNameZh": "黑翅草蝉",
      "scientificName": "Mogannia formosana",
      "mediaFile": "Mogannia formosana - Cicadas in Taiwan.mp4",
      "volume": 58,
      "activeMonths": [5, 6, 7, 8, 9],
      "peakMonths": [5, 6],
      "callingWindows": ["07:00-15:00"],
      "evidenceLevel": "high",
      "evidenceNote": "2011年台湾山地自动录音：5月至9月上半，主要约07:30–14:30。",
      "sourceIds": ["shieh_2015"]
    },
    {
      "id": "euterpnosia_varicolor",
      "displayOrder": 130,
      "enabled": true,
      "autoEligible": true,
      "autoPriority": 70,
      "commonNameZh": "太平姬春蝉",
      "scientificName": "Euterpnosia varicolor",
      "mediaFile": "Euterpnosia varicolor - Cicadas in Taiwan.mp4",
      "volume": 58,
      "activeMonths": [5, 6],
      "peakMonths": [],
      "callingWindows": ["06:00-18:30"],
      "evidenceLevel": "high",
      "evidenceNote": "分类修订记载成虫主要5–6月，雄虫喜晴天鸣叫。",
      "sourceIds": ["euterpnosia_varicolor_review"]
    },
    {
      "id": "leptosemia_sakaii",
      "displayOrder": 140,
      "enabled": true,
      "autoEligible": true,